5, Отличные наушники,удобные.Хорошо сидят на шее.Приятные к телу,хорошо сидят в ушах.Блютуз ловит на длинное расстояние.Гарантия 12месяцев.Не жалею о покупке,спасибо! Переваги: Хорошие!Звук четкий Недоліки: Пока нет
4, Наушники звучат более менее, есть намёк на низкие частоты, подключил легко и быстро, носить удобно, в целом не плохо. Единственное, что чехол который рекомендовала розетка в комплект с этими ушами не подошёл. Переваги: Удобные, нормальный звук. Недоліки: Пока не нашёл.
4, При разговоре меня практически не слышат, звук сливается, приходиться говорит медленно, поднося левую дужку поближе. Может попался бракованный микрофон? Переваги: приятный ободок, классное звучание, хорошее соединение Недоліки: при разговоре меня очень плохо слышат
5, Отличные наушники
5, Три дня назад купил себе эти наушники. Покупал не в розетке, так как хотел чёрные, а в розетке были только белые. Зато в оффлайновом магазине продавец сразу приконнектил их к моему телефону. Сказать, что они хорошо звучат - это ничего не сказать. У меня есть проводные наушники Sennheiser CX300, так вот эти филипсы звучат не хуже. Дужка на шею чёрная, на ощупь вроде как резиновая. Сами наушники (затычки) не чёрные, а с очень красивым тёмно-синим отливом. Смотрятся намного дороже, чем стоят. Инструкцию явно писали китайцы для китайцев. Пришлось осваивать методом научного тыка. Например, чтобы выключить гарнитуру, надо нажать и удерживать овальную кнопку до тех пор, пока светодиод не сменит цвет с синего на белый. При этом в наушниках раздастся характерный звуковой сигнал. В целом наушниками (гарнитурой) очень доволен. Единственный недостаток - очень короткий зарядный шнурок, но я заряжаю самсунговской зарядкой от телефона. Переваги: Красивые, удобные, хорошо звучат. Стандартное гнездо позволяет заряжать их любой Micro-USB зарядкой. Недоліки: Короткий шнур зарядки, бестолковая инструкция.
2, такой вопрос, в заявленной характеристике должен присутствовать последний набор номера и удержание, это же какую из имеющихся трех кнопок нужно нажать, и как, что бы это получилось сделать? кто с этим сталкивался, скажите, плиз Переваги: приятный ободок, чего то играют Недоліки: при разговоре меня слышат как в бочке
4, Подключил без проблем, звук музыки конечно не сравнить с sennheiser, но этого и не ждал, главное. что звучат лучше тех же фмлипсов но проводных, высокие и низкие есть, средних почти нет, но за свои деньги очень не плохо. На шее сидят очень уверенно не сползают даже при прыжках. Еще одно нигде не пишут о том, что соеденяются правая и левая часть резиновой ножкой, довольно эластичной т надеюсь долговечной. Переваги: цена, качество звучания Недоліки: если большая шея, как у меня, то есть риск закрыть микрофон
